INFO:root:Checking files: atom.xml exists=True, feed.json exists=True
INFO:root:Fetching https://www.dicio.com.br/palavra-do-dia/ - Status Code: 200
INFO:root:Response length: 118945 characters
INFO:root:HTML parsed, length: 112219 characters
INFO:root:Found 3 titles: ['Palavra de Hoje (01/01/2026)', 'Palavra de Ontem (31/12/2025)', 'Palavra de Anteontem (30/12/2025)']
INFO:root:Found 3 URLs: ['/geleia/', '/voce/', '/plenilunio/']
INFO:root:Found 12 descriptions: ['substantivo feminino [Culinária] Preparado de frut', 'Sinônimos:\n\ngelatina', 'Classe gramatical:substantivo feminino']
INFO:root:Found 3 dates: ['Palavra de Hoje (01/01/2026)', 'Palavra de Ontem (31/12/2025)', 'Palavra de Anteontem (30/12/2025)']
INFO:root:Min length for iteration: 3
INFO:root:Processing entry 1: Title='Palavra de Hoje (01/01/2026)', ID=06c8486e2ed5acd04b9901adc25f6da5
INFO:root:Processing entry 2: Title='Palavra de Ontem (31/12/2025)', ID=fae74c27a53fad8314ac3d0bdddfbe94
INFO:root:Processing entry 3: Title='Palavra de Anteontem (30/12/2025)', ID=20d6efd713a066f243172036071b0561
INFO:root:Processed 3 entries in FeedGenerator, 3 entries in output_data
INFO:root:Updated 'feeds/palavra_do_dia/atom.xml' with 3 entries.
INFO:root:Updated 'feeds/palavra_do_dia/feed.json' with 3 entries.
INFO:root:
📌 Last 3 entries:
INFO:root:🔹 Title: Palavra de Hoje (01/01/2026) - Significado completo de geleia:
INFO:root:🔹 URL: https://www.dicio.com.br/geleia/
INFO:root:🔹 Description: substantivo feminino [Culinária] Preparado de frutas que se deixa congelar, tomando consistência mole e trêmula.Preparado culinário pastoso, feito com substâncias gelatinosas, industrializadas ou não, usado na feitura de variados pratos doces ou salgados.Etimologia (origem da palavra geleia). A palavra gelatina tem sua origem no francês "gelée", com o mesmo sentido.
 
Sinônimos:

gelatina 

INFO:root:--------------------------------------------------
INFO:root:🔹 Title: Palavra de Ontem (31/12/2025) - Significado completo de você:
INFO:root:🔹 URL: https://www.dicio.com.br/voce/
INFO:root:🔹 Description: Sinônimos:

gelatina
 Classe gramatical:substantivo feminino
INFO:root:--------------------------------------------------
INFO:root:🔹 Title: Palavra de Anteontem (30/12/2025) - Significado completo de plenilúnio:
INFO:root:🔹 URL: https://www.dicio.com.br/plenilunio/
INFO:root:🔹 Description: Classe gramatical:substantivo feminino
 Sílabas:ge-lei-a
INFO:root:--------------------------------------------------
INFO:root:Checking files: atom.xml exists=True, feed.json exists=True
INFO:root:Fetching https://www.example.com/feed/ - Status Code: 404
INFO:root:Response length: 513 characters
WARNING:root:Failed to fetch content from https://www.example.com/feed/ - Status: 404
INFO:root:Checking files: atom.xml exists=True, feed.json exists=True
INFO:root:Fetching https://www.bibliaon.com/versiculo_do_dia/ - Status Code: 200
INFO:root:Response length: 332103 characters
INFO:root:HTML parsed, length: 321683 characters
INFO:root:Found 1 titles: ['Atos dos Apóstolos 4:12']
INFO:root:Found 1 URLs: ['/versiculo/atos_dos_apostolos_4_12/']
INFO:root:Found 1 descriptions: ['Não há salvação em nenhum outro, pois, debaixo do ']
INFO:root:Found 1 dates: ['']
INFO:root:Min length for iteration: 1
INFO:root:Processing entry 1: Title='Atos dos Apóstolos 4:12', ID=01ac74659f1c8c226c313ce90886f591
INFO:root:Processed 1 entries in FeedGenerator, 1 entries in output_data
INFO:root:Updated 'feeds/versículo_do_dia/atom.xml' with 1 entries.
INFO:root:Updated 'feeds/versículo_do_dia/feed.json' with 1 entries.
INFO:root:
📌 Last 3 entries:
INFO:root:🔹 Title: Atos dos Apóstolos 4:12
INFO:root:🔹 URL: https://www.bibliaon.com/versiculo/atos_dos_apostolos_4_12/
INFO:root:🔹 Description: Não há salvação em nenhum outro, pois, debaixo do céu não há nenhum outro nome dado aos homens pelo qual devamos ser salvos". Atos dos Apóstolos 4:12
INFO:root:--------------------------------------------------
INFO:root:Checking files: atom.xml exists=True, feed.json exists=True
INFO:root:Fetching https://www.bibliaon.com/salmo_do_dia/ - Status Code: 504
INFO:root:Response length: 160 characters
WARNING:root:Failed to fetch content from https://www.bibliaon.com/salmo_do_dia/ - Status: 504
INFO:root:Checking files: atom.xml exists=True, feed.json exists=True
INFO:root:Fetching https://www.bibliaon.com/palavra_do_dia/ - Status Code: 200
INFO:root:Response length: 334586 characters
INFO:root:HTML parsed, length: 324631 characters
INFO:root:Found 3 titles: ['Louvado seja Deus e lembre-se de quem Ele é para você', 'O reconhecimento vem de Deus', 'Chamado, amado e cuidado']
INFO:root:Found 3 URLs: [None, None, None]
INFO:root:Found 3 descriptions: ['O Senhor é a minha força\ne a minha canção;\nele é a', 'Não é do oriente nem do ocidente\nnem do deserto qu', '(...) aos que foram chamados, amados por Deus Pai ']
INFO:root:Found 1 dates: ['Quinta, 1 de janeiro de 2026']
INFO:root:Min length for iteration: 1
INFO:root:Processing entry 1: Title='Louvado seja Deus e lembre-se de quem Ele é para você', ID=68ff648f6ba574b072055406ccc741ac
INFO:root:Processed 1 entries in FeedGenerator, 1 entries in output_data
INFO:root:Updated 'feeds/palavra_biblica_do_dia/atom.xml' with 1 entries.
INFO:root:Updated 'feeds/palavra_biblica_do_dia/feed.json' with 1 entries.
INFO:root:
📌 Last 3 entries:
INFO:root:🔹 Title: Louvado seja Deus e lembre-se de quem Ele é para você - Palavra de Hoje
INFO:root:🔹 URL: https://www.bibliaon.com/palavra_do_dia/
INFO:root:🔹 Description: O Senhor é a minha força
e a minha canção;
ele é a minha salvação!
Ele é o meu Deus, e eu o louvarei;
é o Deus de meu pai, e eu o exaltarei!
- Êxodo 15:2


"Quem entre os deuses
é semelhante a ti, Senhor?
Quem é semelhante a ti?
Majestoso em santidade,
terrível em feitos gloriosos,
autor de maravilhas?
- Êxodo 15:11

Deus tem feito tanto por nós! É pela Sua graça e amor que estamos aqui hoje. Mas, muitas vezes, com a correria do dia a dia e os problemas que nos afligem, deixamos de reconhecer as constantes demonstrações de amor que Ele nos dá e nos concentramos, em vez disso, em tudo o que está errado ou no que precisamos.
Deus se alegra quando nos aproximamos Dele com confiança, pedindo Sua ajuda em meio às nossas dificuldades. Mas devemos lembrar que, mesmo quando há problemas, Deus continua sendo bom, Ele está conosco e é digno do nosso louvor. Aliás, deixar de lado nossas queixas e nos concentrar em adorar a Deus fortalece nossos corações, renova nossos espíritos e nos dá a coragem para enfrentar os desafios da vida.
Reserve alguns minutos hoje para louvar a Deus de coração e agradecê-Lo por tudo o que Ele tem feito por você. Lembre-se dos momentos em que Ele o sustentou, das portas que Ele abriu, da paz que Ele lhe deu em meio à tempestade e das lições que você aprendeu em tempos difíceis.
Louve-O, porque, em meio a tudo isso, Ele tem sido um Deus fiel, poderoso e sempre presente. Eleve seus olhos ao céu e olhe para o Senhor. Concentre-se Nele e você deixará de ver seus problemas como gigantes intransponíveis. Você se lembrará de que serve ao Deus Todo-Poderoso que o ama e cuida de você. Sua presença o acompanha todos os dias, mesmo nos momentos mais difíceis ou incertos, e com Ele você pode seguir em frente.
Decida fazer do louvor um hábito, não apenas uma reação. Reconheça quem Deus é para você: seu refúgio, sua força, seu salvador e sua esperança. Permita que seu coração transborde de gratidão e que suas palavras glorifiquem o Seu nome. Ao fazer isso, você experimentará como a paz Dele guarda sua mente e a alegria Dele renova suas forças para seguir em frente com confiança e fé.
Veja também: Versículos sobre Louvor
 
O Senhor é a minha força
e a minha canção;
ele é a minha salvação!
Ele é o meu Deus, e eu o louvarei;
é o Deus de meu pai, e eu o exaltarei!
- Êxodo 15:2

INFO:root:--------------------------------------------------
INFO:root:Checking files: atom.xml exists=True, feed.json exists=True
INFO:root:Fetching https://www.bibliaon.com/devocional_diario/ - Status Code: 200
INFO:root:Response length: 345564 characters
INFO:root:HTML parsed, length: 335155 characters
INFO:root:Found 3 titles: ['O começo de uma nova história', 'Até aqui o Deus que conduz nossa história nos ajudou', 'Cuidar da saúde é cuidar da alma']
INFO:root:Found 2 URLs: ['/plano_de_leitura_biblica_2026/', '/corpo_humano/']
INFO:root:Found 3 descriptions: ['Aquele que estava assentado no trono disse: "Estou', 'Até aqui o Senhor nos ajudou.\n- 1 Samuel 7:12b\n\nAo', 'Cuidar da saúde é cuidar da alma, pois Deus nos cr']
INFO:root:Found 3 dates: ['JANEIRO\n\n1\nQUINTA', 'DEZEMBRO\n\n31\nQUARTA', 'DEZEMBRO\n\n30\nTERÇA']
INFO:root:Min length for iteration: 2
INFO:root:Processing entry 1: Title='O começo de uma nova história', ID=67d25a2a7d6b878cd2748fe9a675da82
INFO:root:Processing entry 2: Title='Até aqui o Deus que conduz nossa história nos ajudou', ID=c65fc90ccc0f5043458a959ba9cc3582
INFO:root:Processed 2 entries in FeedGenerator, 2 entries in output_data
INFO:root:Updated 'feeds/devocional_de_hoje/atom.xml' with 2 entries.
INFO:root:Updated 'feeds/devocional_de_hoje/feed.json' with 2 entries.
INFO:root:
📌 Last 3 entries:
INFO:root:🔹 Title: O começo de uma nova história
INFO:root:🔹 URL: https://www.bibliaon.com/plano_de_leitura_biblica_2026/
INFO:root:🔹 Description: Aquele que estava assentado no trono disse: "Estou fazendo novas todas as coisas!"
- Apocalipse 21:5a

O primeiro dia do ano é carregado de simbolismo. Há uma sensação de recomeço, de página limpa, de novos caminhos. A Bíblia nos ensina que Deus é especialista em renovação. Ele transforma histórias, corações, relacionamentos e futuros.
Ao iniciar um novo ano, lembramos que a grande renovação prometida por Deus já começou em Jesus. O Reino que Ele inaugurou continua crescendo, e somos convidados a fazer parte dessa obra de renovação.
Hoje é oportunidade de alinhar a vida ao que Deus está fazendo. Ele não apenas renova circunstâncias: Ele renova quem somos. Você crê que Ele quer? Você crê que Ele pode? Então receba! Feliz Ano-Novo!
Comece o ano com tudo

Comece o ano pedindo que Deus renove sua mente, seus hábitos e seus relacionamentos.
Estabeleça um compromisso espiritual simples e possível: orar diariamente, ler um trecho da Bíblia, praticar bondade de maneira intencional.
Decida buscar primeiro o Reino de Deus em cada área da sua vida neste novo ano.

Por que não fazer o compromisso de ler a Bíblia toda durante este anos? Para te ajudar, preparamos este Plano de Leitura Bíblica para 2026.
Para orar:

Senhor, inicia em mim uma obra nova neste primeiro dia do ano. Que teu Espírito renove minha esperança, minha fé e minhas escolhas. Que eu caminhe contigo em cada passo deste novo ciclo. Abençoa este novo ano, guia os meus passos e traz-me para bem perto de Ti. Em nome de Jesus. Amém.
INFO:root:--------------------------------------------------
INFO:root:🔹 Title: Até aqui o Deus que conduz nossa história nos ajudou
INFO:root:🔹 URL: https://www.bibliaon.com/corpo_humano/
INFO:root:🔹 Description: Até aqui o Senhor nos ajudou.
- 1 Samuel 7:12b

Ao encerrar mais um ano, olhamos para trás e percebemos como nossa história foi marcada por alegrias, desafios, perdas e aprendizados. A mensagem das Escrituras nos lembra que Deus está conduzindo um enredo muito maior que o nosso.
Assim como Ele guiou o seu povo no passado e cumpriu suas promessas em Jesus, Ele continua guiando nossa vida hoje. A véspera de ano-novo se torna, então, um convite para enxergarmos nosso tempo dentro do tempo de Deus. Cada etapa, cada estação, cada mudança faz parte de algo maior que Ele está escrevendo. E você faz parte disso. Aleluia!
Ao entregar o ano que passou e colocar o próximo diante dele, encontramos sabedoria e paz.
Para colocar em prática:

Agradeça a Deus por três coisas específicas que Ele fez por você neste ano.
Entregue a Ele algo que você não quer carregar para o próximo ano.
Peça que Deus alinhe seus planos com o propósito dele para você.

Para orar

Pai, obrigado por estar comigo em cada passo deste ano. Quero encerrar este ciclo na tua presença e começar o próximo confiando em ti. Guia meus dias e dá-me sabedoria para viver segundo tua vontade. Amém.
INFO:root:--------------------------------------------------
INFO:root:Checking files: atom.xml exists=True, feed.json exists=True
INFO:root:Fetching https://pt.wikipedia.org/wiki/Wikipédia:Página_principal - Status Code: 403
INFO:root:Response length: 126 characters
WARNING:root:Failed to fetch content from https://pt.wikipedia.org/wiki/Wikipédia:Página_principal - Status: 403
INFO:root:Checking files: atom.xml exists=True, feed.json exists=True
INFO:root:Fetching https://pt.wikipedia.org/wiki/Wikipédia:Página_principal - Status Code: 403
INFO:root:Response length: 126 characters
WARNING:root:Failed to fetch content from https://pt.wikipedia.org/wiki/Wikipédia:Página_principal - Status: 403
INFO:root:Checking files: atom.xml exists=True, feed.json exists=True
INFO:root:Fetching https://pt.wikipedia.org/wiki/Wikipédia:Página_principal - Status Code: 403
INFO:root:Response length: 126 characters
WARNING:root:Failed to fetch content from https://pt.wikipedia.org/wiki/Wikipédia:Página_principal - Status: 403
INFO:root:Git identity configured.
INFO:root:
📝 Git Changes Detected:
INFO:root: M feeds/devocional_de_hoje/atom.xml
 M feeds/devocional_de_hoje/feed.json
 M feeds/palavra_biblica_do_dia/atom.xml
 M feeds/palavra_biblica_do_dia/feed.json
 M feeds/palavra_do_dia/atom.xml
 M feeds/palavra_do_dia/feed.json
 M "feeds/vers\303\255culo_do_dia/atom.xml"
 M "feeds/vers\303\255culo_do_dia/feed.json"
 M output.log
?? __pycache__/
INFO:root:
🔍 Summary:
INFO:root: feeds/devocional_de_hoje/atom.xml         |  43 ++--
 feeds/devocional_de_hoje/feed.json        |  12 +-
 feeds/palavra_biblica_do_dia/atom.xml     |  43 ++--
 feeds/palavra_biblica_do_dia/feed.json    |   6 +-
 feeds/palavra_do_dia/atom.xml             |  12 +-
 feeds/palavra_do_dia/feed.json            |  24 +-
 "feeds/vers\303\255culo_do_dia/atom.xml"  |   2 +-
 "feeds/vers\303\255culo_do_dia/feed.json" |   8 +-
 output.log                                | 375 ++++++++----------------------
 9 files changed, 171 insertions(+), 354 deletions(-)
